{
  "format": "premed-os-anki-build",
  "version": 1,
  "deckKey": "synthetic-prompt-draft-1",
  "deckName": "Synthetic Flashcard Check",
  "journalTitle": "Synthetic prerequisite fixture",
  "scope": "Packaging checks only",
  "sources": [
    {
      "id": "synthetic",
      "title": "Synthetic fixture",
      "access": "readable",
      "limitations": ""
    }
  ],
  "targets": [
    {
      "id": "plain",
      "topic": "Synthetic",
      "statement": "plain",
      "core": true,
      "coverage": "tested",
      "cardIds": [
        "plain"
      ],
      "reason": "",
      "kind": "understand"
    },
    {
      "id": "why",
      "topic": "Synthetic",
      "statement": "why",
      "core": true,
      "coverage": "tested",
      "cardIds": [
        "why"
      ],
      "reason": "",
      "kind": "understand"
    },
    {
      "id": "compare",
      "topic": "Synthetic",
      "statement": "compare",
      "core": true,
      "coverage": "tested",
      "cardIds": [
        "compare"
      ],
      "reason": "",
      "kind": "understand"
    },
    {
      "id": "process",
      "topic": "Synthetic",
      "statement": "process",
      "core": true,
      "coverage": "tested",
      "cardIds": [
        "process"
      ],
      "reason": "",
      "kind": "understand"
    },
    {
      "id": "apply",
      "topic": "Synthetic",
      "statement": "apply",
      "core": true,
      "coverage": "tested",
      "cardIds": [
        "apply"
      ],
      "reason": "",
      "kind": "understand"
    },
    {
      "id": "recognize",
      "topic": "Synthetic",
      "statement": "recognize",
      "core": true,
      "coverage": "tested",
      "cardIds": [
        "recognize"
      ],
      "reason": "",
      "kind": "understand"
    },
    {
      "id": "produce",
      "topic": "Synthetic",
      "statement": "produce",
      "core": true,
      "coverage": "tested",
      "cardIds": [
        "produce"
      ],
      "reason": "",
      "kind": "understand"
    },
    {
      "id": "blurt",
      "topic": "Synthetic",
      "statement": "blurt",
      "core": true,
      "coverage": "tested",
      "cardIds": [
        "blurt"
      ],
      "reason": "",
      "kind": "understand"
    },
    {
      "id": "cloze",
      "topic": "Synthetic",
      "statement": "cloze",
      "core": true,
      "coverage": "tested",
      "cardIds": [
        "cloze"
      ],
      "reason": "",
      "kind": "understand"
    },
    {
      "id": "definition",
      "topic": "Synthetic",
      "statement": "definition",
      "core": true,
      "coverage": "tested",
      "cardIds": [
        "definition"
      ],
      "reason": "",
      "kind": "understand"
    },
    {
      "id": "list",
      "topic": "Synthetic",
      "statement": "list",
      "core": true,
      "coverage": "tested",
      "cardIds": [
        "list"
      ],
      "reason": "",
      "kind": "understand"
    },
    {
      "id": "image",
      "topic": "Synthetic",
      "statement": "image",
      "core": true,
      "coverage": "tested",
      "cardIds": [
        "image"
      ],
      "reason": "",
      "kind": "understand"
    },
    {
      "id": "rebuild",
      "topic": "Synthetic",
      "statement": "Reproduce the sample pathway.",
      "core": true,
      "coverage": "tested",
      "cardIds": [
        "rebuild"
      ],
      "reason": "",
      "kind": "understand"
    }
  ],
  "cards": [
    {
      "id": "plain",
      "conceptId": "plain",
      "targetIds": [
        "plain"
      ],
      "type": "basic",
      "front": "What label appears on the sample?",
      "back": "A blue square.",
      "cloze": "",
      "clozePattern": null,
      "listOrdered": null,
      "recallItems": [],
      "axis": "",
      "exampleDirection": null,
      "examplePairId": "",
      "explanation": "This explanation is test content for the Extra layout.",
      "example": null,
      "reinforcementReason": "",
      "sourceRefs": [
        {
          "sourceId": "synthetic",
          "location": "Synthetic fixture",
          "excerpt": "Test data for file validation, not student material."
        }
      ],
      "frontImages": [],
      "extraImages": [],
      "tags": [
        "synthetic-fixture"
      ]
    },
    {
      "id": "why",
      "conceptId": "why",
      "targetIds": [
        "why"
      ],
      "type": "conceptual",
      "front": "Why is the answer separate from Extra?",
      "back": "The answer states what must be recalled. Extra helps explain it.",
      "cloze": "",
      "clozePattern": null,
      "listOrdered": null,
      "recallItems": [],
      "axis": "",
      "exampleDirection": null,
      "examplePairId": "",
      "explanation": "This explanation is test content for the Extra layout.",
      "example": null,
      "reinforcementReason": "",
      "sourceRefs": [
        {
          "sourceId": "synthetic",
          "location": "Synthetic fixture",
          "excerpt": "Test data for file validation, not student material."
        }
      ],
      "frontImages": [],
      "extraImages": [],
      "tags": [
        "synthetic-fixture"
      ]
    },
    {
      "id": "compare",
      "conceptId": "compare",
      "targetIds": [
        "compare"
      ],
      "type": "comparison",
      "front": "How do the two boxes differ in size?",
      "back": "The left box is larger than the right box.",
      "cloze": "",
      "clozePattern": null,
      "listOrdered": null,
      "recallItems": [],
      "axis": "size",
      "exampleDirection": null,
      "examplePairId": "",
      "explanation": "This explanation is test content for the Extra layout.",
      "example": null,
      "reinforcementReason": "",
      "sourceRefs": [
        {
          "sourceId": "synthetic",
          "location": "Synthetic fixture",
          "excerpt": "Test data for file validation, not student material."
        }
      ],
      "frontImages": [],
      "extraImages": [],
      "tags": [
        "synthetic-fixture"
      ]
    },
    {
      "id": "process",
      "conceptId": "process",
      "targetIds": [
        "process"
      ],
      "type": "process",
      "front": "What comes after the first step in this sample?",
      "back": "The second step follows the first.",
      "cloze": "",
      "clozePattern": null,
      "listOrdered": null,
      "recallItems": [],
      "axis": "",
      "exampleDirection": null,
      "examplePairId": "",
      "explanation": "This explanation is test content for the Extra layout.",
      "example": null,
      "reinforcementReason": "",
      "sourceRefs": [
        {
          "sourceId": "synthetic",
          "location": "Synthetic fixture",
          "excerpt": "Test data for file validation, not student material."
        }
      ],
      "frontImages": [],
      "extraImages": [],
      "tags": [
        "synthetic-fixture"
      ]
    },
    {
      "id": "apply",
      "conceptId": "apply",
      "targetIds": [
        "apply"
      ],
      "type": "application",
      "front": "A sample button becomes enabled after a field is filled. What can you do next?",
      "back": "Press the button.",
      "cloze": "",
      "clozePattern": null,
      "listOrdered": null,
      "recallItems": [],
      "axis": "",
      "exampleDirection": null,
      "examplePairId": "",
      "explanation": "This explanation is test content for the Extra layout.",
      "example": null,
      "reinforcementReason": "",
      "sourceRefs": [
        {
          "sourceId": "synthetic",
          "location": "Synthetic fixture",
          "excerpt": "Test data for file validation, not student material."
        }
      ],
      "frontImages": [],
      "extraImages": [],
      "tags": [
        "synthetic-fixture"
      ]
    },
    {
      "id": "recognize",
      "conceptId": "triangle-recognition",
      "targetIds": [
        "recognize"
      ],
      "type": "exemplar",
      "front": "A sample contains three sides. Which shape is it?",
      "back": "A triangle.",
      "cloze": "",
      "clozePattern": null,
      "listOrdered": null,
      "recallItems": [],
      "axis": "",
      "exampleDirection": "instance-to-concept",
      "examplePairId": "",
      "explanation": "This explanation is test content for the Extra layout.",
      "example": null,
      "reinforcementReason": "",
      "sourceRefs": [
        {
          "sourceId": "synthetic",
          "location": "Synthetic fixture",
          "excerpt": "Test data for file validation, not student material."
        }
      ],
      "frontImages": [],
      "extraImages": [],
      "tags": [
        "synthetic-fixture"
      ]
    },
    {
      "id": "produce",
      "conceptId": "circle-example",
      "targetIds": [
        "produce"
      ],
      "type": "exemplar",
      "front": "Example of a circular object",
      "back": "A circular paper cutout.",
      "cloze": "",
      "clozePattern": null,
      "listOrdered": null,
      "recallItems": [],
      "axis": "",
      "exampleDirection": "concept-to-instance",
      "examplePairId": "",
      "explanation": "This explanation is test content for the Extra layout.",
      "example": null,
      "reinforcementReason": "",
      "sourceRefs": [
        {
          "sourceId": "synthetic",
          "location": "Synthetic fixture",
          "excerpt": "Test data for file validation, not student material."
        }
      ],
      "frontImages": [],
      "extraImages": [],
      "tags": [
        "synthetic-fixture"
      ]
    },
    {
      "id": "blurt",
      "conceptId": "blurt",
      "targetIds": [
        "blurt"
      ],
      "type": "free-recall",
      "front": "Recall the 3 parts of this sample card.",
      "back": "",
      "cloze": "",
      "clozePattern": null,
      "listOrdered": null,
      "recallItems": [
        "The front asks the question.",
        "The back gives the required answer.",
        "Extra explains the idea."
      ],